{
  "$schema": "https://decantr.ai/schemas/page-pack.v1.json",
  "packVersion": "1.0.0",
  "packType": "page",
  "objective": "Implement the profile route using the compiled page contract.",
  "target": {
    "platform": "web",
    "framework": "nextjs",
    "runtime": "spa",
    "adapter": "nextjs"
  },
  "preset": null,
  "scope": {
    "appId": "app",
    "pageIds": [
      "profile"
    ],
    "patternIds": [
      "detail-header",
      "content-card-grid",
      "activity-feed"
    ]
  },
  "requiredSetup": [
    "Keep the compiled route and shell contract stable for this page.",
    "Treat the listed page patterns as the primary structure for this route."
  ],
  "allowedVocabulary": [
    "profile",
    "top-nav-main",
    "registry-browser",
    "public",
    "luminarum",
    "dark",
    "search",
    "pagination",
    "detail-header",
    "row",
    "content-card-grid",
    "grid",
    "activity-feed",
    "column"
  ],
  "examples": [],
  "antiPatterns": [],
  "successChecks": [
    {
      "id": "page-route-contract",
      "label": "The page keeps the compiled route, shell, and section contract intact.",
      "severity": "error"
    },
    {
      "id": "page-pattern-contract",
      "label": "The page preserves its primary compiled patterns instead of drifting into unrelated layouts.",
      "severity": "error"
    },
    {
      "id": "page-state-contract",
      "label": "Any declared wiring signals remain coherent with the rendered page structure.",
      "severity": "warn"
    }
  ],
  "tokenBudget": {
    "target": 1400,
    "max": 2200,
    "strategy": [
      "Prefer route summaries over repeated prose.",
      "Use compact vocabulary lists instead of large reference tables.",
      "Include only task-relevant examples and checks."
    ]
  },
  "data": {
    "pageId": "profile",
    "path": "/profile/:username",
    "shell": "top-nav-main",
    "sectionId": "registry-browser",
    "sectionRole": "public",
    "features": [
      "search",
      "pagination"
    ],
    "surface": "_flex _col _gap4",
    "theme": {
      "id": "luminarum",
      "mode": "dark",
      "shape": "rounded"
    },
    "wiringSignals": [],
    "patterns": [
      {
        "id": "detail-header",
        "alias": "detail-header",
        "preset": "standard",
        "layout": "row",
        "presetDescription": "Title, subtitle/description, status badge, breadcrumb, and action buttons. Horizontal layout with bottom border.",
        "interactions": [
          "hover-reveal",
          "keyboard-navigation",
          "animate-on-mount",
          "click-select"
        ]
      },
      {
        "id": "content-card-grid",
        "alias": "content-card-grid",
        "preset": "standard",
        "layout": "grid",
        "presetDescription": "Registry content cards with optional 16:9 media, one type chip, a 3-line description, and a clean source/version/date footer. Grid: 1/2/3 cols at sm/md/lg.",
        "interactions": [
          "lift-hover",
          "stagger-children",
          "animate-on-mount",
          "click-select",
          "scroll-reveal"
        ]
      },
      {
        "id": "activity-feed",
        "alias": "activity-feed",
        "preset": "standard",
        "layout": "column",
        "presetDescription": "Vertical timeline with avatar, user name, action text, timestamp. Grouped by date.",
        "interactions": [
          "animate-on-mount",
          "stagger-children",
          "real-time-updates",
          "hover-reveal",
          "scroll-reveal"
        ]
      }
    ]
  },
  "renderedMarkdown": "# Page Pack\n\n**Objective:** Implement the profile route using the compiled page contract.\n**Target:** nextjs (nextjs)\n**Scope:** pages=profile | patterns=detail-header, content-card-grid, activity-feed\n\n## Page Contract\n- Page: profile\n- Path: /profile/:username\n- Shell: top-nav-main\n- Section: registry-browser (public)\n- Theme: luminarum (dark)\n- Features: search, pagination\n- Surface: _flex _col _gap4\n\n## Page Patterns\n- detail-header -> detail-header [row | standard]\n  > Title, subtitle/description, status badge, breadcrumb, and action buttons. Horizontal layout with bottom border.\n  **Interactions (MUST implement each — see DECANTR.md \"Interaction Requirements\"):**\n  - [ ] hover-reveal\n  - [ ] keyboard-navigation\n  - [ ] animate-on-mount\n  - [ ] click-select\n- content-card-grid -> content-card-grid [grid | standard]\n  > Registry content cards with optional 16:9 media, one type chip, a 3-line description, and a clean source/version/date footer. Grid: 1/2/3 cols at sm/md/lg.\n  **Interactions (MUST implement each — see DECANTR.md \"Interaction Requirements\"):**\n  - [ ] lift-hover\n  - [ ] stagger-children\n  - [ ] animate-on-mount\n  - [ ] click-select\n  - [ ] scroll-reveal\n- activity-feed -> activity-feed [column | standard]\n  > Vertical timeline with avatar, user name, action text, timestamp. Grouped by date.\n  **Interactions (MUST implement each — see DECANTR.md \"Interaction Requirements\"):**\n  - [ ] animate-on-mount\n  - [ ] stagger-children\n  - [ ] real-time-updates\n  - [ ] hover-reveal\n  - [ ] scroll-reveal\n\n## Shared Contract\nRequired setup, allowed vocabulary, success checks, anti-patterns, and token budget are shared across every page pack. The full list lives in the pack JSON sidecar (`page-<id>-pack.json`) and in the pack-manifest. Refer there instead of re-reading the same boilerplate 16 times.\n"
}
