{
  "$schema": "https://decantr.ai/schemas/page-pack.v1.json",
  "packVersion": "1.0.0",
  "packType": "page",
  "objective": "Implement the content route using the compiled page contract.",
  "target": {
    "platform": "web",
    "framework": "nextjs",
    "runtime": "ssr",
    "adapter": "nextjs"
  },
  "preset": null,
  "scope": {
    "appId": "app",
    "pageIds": [
      "content"
    ],
    "patternIds": [
      "content-card-grid"
    ]
  },
  "requiredSetup": [
    "Keep the compiled route and shell contract stable for this page.",
    "Treat the listed page patterns as the primary structure for this route."
  ],
  "allowedVocabulary": [
    "content",
    "sidebar-main",
    "user-dashboard",
    "primary",
    "luminarum",
    "dark",
    "auth",
    "api-keys",
    "content-card-grid",
    "grid"
  ],
  "examples": [],
  "antiPatterns": [],
  "successChecks": [
    {
      "id": "page-route-contract",
      "label": "The page keeps the compiled route, shell, and section contract intact.",
      "severity": "error"
    },
    {
      "id": "page-pattern-contract",
      "label": "The page preserves its primary compiled patterns instead of drifting into unrelated layouts.",
      "severity": "error"
    },
    {
      "id": "page-state-contract",
      "label": "Any declared wiring signals remain coherent with the rendered page structure.",
      "severity": "warn"
    }
  ],
  "tokenBudget": {
    "target": 1400,
    "max": 2200,
    "strategy": [
      "Prefer route summaries over repeated prose.",
      "Use compact vocabulary lists instead of large reference tables.",
      "Include only task-relevant examples and checks."
    ]
  },
  "data": {
    "pageId": "content",
    "path": "/dashboard/content",
    "shell": "sidebar-main",
    "sectionId": "user-dashboard",
    "sectionRole": "primary",
    "features": [
      "auth",
      "api-keys"
    ],
    "surface": "_flex _col _gap4",
    "theme": {
      "id": "luminarum",
      "mode": "dark",
      "shape": "rounded"
    },
    "wiringSignals": [],
    "patterns": [
      {
        "id": "content-card-grid",
        "alias": "content-card-grid",
        "preset": "standard",
        "layout": "grid",
        "presetDescription": "Registry content cards with optional 16:9 media, one type chip, a 3-line description, and a clean source/version/date footer. Grid: 1/2/3 cols at sm/md/lg.",
        "interactions": [
          "lift-hover",
          "stagger-children",
          "animate-on-mount",
          "click-select",
          "scroll-reveal"
        ]
      }
    ]
  },
  "renderedMarkdown": "# Page Pack\n\n**Objective:** Implement the content route using the compiled page contract.\n**Target:** nextjs (nextjs)\n**Scope:** pages=content | patterns=content-card-grid\n\n## Page Contract\n- Page: content\n- Path: /dashboard/content\n- Shell: sidebar-main\n- Section: user-dashboard (primary)\n- Theme: luminarum (dark)\n- Features: auth, api-keys\n- Surface: _flex _col _gap4\n\n## Page Patterns\n- content-card-grid -> content-card-grid [grid | standard]\n  > Registry content cards with optional 16:9 media, one type chip, a 3-line description, and a clean source/version/date footer. Grid: 1/2/3 cols at sm/md/lg.\n  **Interactions (MUST implement each — see DECANTR.md \"Interaction Requirements\"):**\n  - [ ] lift-hover\n  - [ ] stagger-children\n  - [ ] animate-on-mount\n  - [ ] click-select\n  - [ ] scroll-reveal\n\n## Shared Contract\nRequired setup, allowed vocabulary, success checks, anti-patterns, and token budget are shared across every page pack. The full list lives in the pack JSON sidecar (`page-<id>-pack.json`) and in the pack-manifest. Refer there instead of re-reading the same boilerplate 16 times.\n"
}
